{
  "slug": "quantum-brain-success",
  "order": 2,
  "title": "สมองควอนตัมดึงดูดความสำเร็จ",
  "author": "สิรวิชญ์ รัตน์จินดา",
  "blurb": "เล่มนี้ชวนมองสมองผ่านแว่นฟิสิกส์ควอนตัม ตั้งแต่กระแสไฟฟ้าและคลื่นความถี่ ไปจนถึงจิตที่เกิดดับต่อเนื่องเป็นสาย แล้วนำไปสู่แนวทางฝึกฝนบุคลิกภาพ ความคิด และการสื่อสารเพื่อสร้างโอกาสความสำเร็จในชีวิต โดยปิดท้ายด้วยบุญซึ่งหนังสือวางเป็นตัวเสริมพลัง และความพอเพียงซึ่งเป็นตัวเบรกความโลภ",
  "coreIdeas": [
    {
      "label": "จิตเกิด-ดับ",
      "text": "หนังสือเสนอว่าจิตที่ผุดขึ้นและดับไปต่อเนื่องเป็นสาย คือกระบวนการทางควอนตัมในสมอง ซึ่งยังเป็นสมมติฐาน"
    },
    {
      "label": "รังสีความคิด",
      "text": "หนังสือเสนอว่าการฝึกส่งพลังความคิดและปรับบุคลิกภาพสร้างแรงดึงดูดที่ส่งผลต่อคนรอบข้างและโอกาสในชีวิต ข้อที่ว่าความคิดส่งผลถึงคนอื่นได้โดยตรงยังไม่มีหลักฐาน"
    },
    {
      "label": "ธรรมค้ำจุน",
      "text": "บทท้ายเล่มพูดถึงบุญ สติ และความพอเพียง หนังสือวางบุญเป็นตัวเสริมพลังดึงดูดความสำเร็จ และวางความพอเพียงเป็นตัวเบรกความโลภ คู่มือชวนอ่านทั้งสองอย่างระวัง"
    }
  ],
  "status": "ready",
  "sourcePdf": {
    "file": "1.2 E-book สมองควอนตัมดึงดูดความสำเร็จ สิรวิชญ์ รัตน์จินดา.pdf",
    "bytes": 4960899
  },
  "chapters": [
    {
      "slug": "ch01",
      "order": 1,
      "thaiNum": "๑",
      "title": "ทำความรู้จักควอนตัมและสนามควอนตัม",
      "sub": "อนุภาคและสนามที่มองไม่เห็น ฐานของสสารทุกอย่างรอบตัว",
      "status": "ready"
    },
    {
      "slug": "ch02",
      "order": 2,
      "thaiNum": "๒",
      "title": "ประจุ กระแส และคลื่นความถี่ควอนตัมในสมอง",
      "sub": "จากอะตอมในเซลล์ประสาท ถึงคลื่นที่แผ่ออกจากความคิด",
      "status": "ready"
    },
    {
      "slug": "ch03",
      "order": 3,
      "thaiNum": "๓",
      "title": "จิตเกิด-ดับ ผลผลิตทางควอนตัม และสมองดิจิทัล",
      "sub": "จิตที่เกิดดับเร็วจนมองไม่ทัน อาจเป็นกลไกควอนตัมเดียวกับที่ทำให้สมองประมวลผลแบบคิวบิต",
      "status": "ready"
    },
    {
      "slug": "ch04",
      "order": 4,
      "thaiNum": "๔",
      "title": "สถานะควอนตัม ความพัวพันทางจิต และการพิชิตความสำเร็จ",
      "sub": "อิเล็กตรอนที่เป็นทั้งคลื่นและอนุภาค กับข้อเสนอของหนังสือว่าจิตสองคนเชื่อมกันได้ไม่ขึ้นกับระยะทาง",
      "status": "ready"
    },
    {
      "slug": "ch05",
      "order": 5,
      "thaiNum": "๕",
      "title": "รังสีส่วนตัวและรังสีกาย",
      "sub": "จากกระแสประสาททั่วร่างกาย ถึงการทดสอบด้วยมือที่หนังสือเสนอ และสิ่งที่มือรู้สึกได้จริง",
      "status": "ready"
    },
    {
      "slug": "ch06",
      "order": 6,
      "thaiNum": "๖",
      "title": "ฝึกเสริมสร้างรังสีกาย และรังสีความคิด",
      "sub": "ยืดแล้วหด หายใจให้ลึก ก่อนดูข้อเสนอของหนังสือว่าทัศนคติที่ถือไว้แผ่เป็นรังสีความคิดได้เอง และสิ่งที่คนรอบตัวรับรู้ได้จริง",
      "status": "ready"
    },
    {
      "slug": "ch07",
      "order": 7,
      "thaiNum": "๗",
      "title": "รังสีความคิดเพื่อการโน้มน้าวใจและการฝึกส่ง",
      "sub": "จากแผ่ออกมาเฉยๆ สู่การตั้งใจส่งกระแสจิต ฝึกหน้ากระจกจนถึงฝึกกับคนจริง",
      "status": "ready"
    },
    {
      "slug": "ch08",
      "order": 8,
      "thaiNum": "๘",
      "title": "การออกคำสั่งขั้นสูงและการปะทะของรังสีส่วนตัว",
      "sub": "จากคำสั่งหน้ากระจกสู่สนามอาชีพ แล้วดูว่าหนังสือสอนให้ตั้งรับและโจมตีอย่างไรเมื่อ 'รังสี' สองฝ่ายปะทะกัน",
      "status": "ready"
    },
    {
      "slug": "ch09",
      "order": 9,
      "thaiNum": "๙",
      "title": "แรงดึงดูดทางความคิดกับความสำเร็จ",
      "sub": "หารูปปึกธนบัตรมาจ้องมอง สั่งไม่ใช่แค่บอก แล้วดูว่าหนังสืออ่านการนึกภาพก่อนตีของไทเกอร์ วูดส์ อย่างไร",
      "status": "ready"
    },
    {
      "slug": "ch10",
      "order": 10,
      "thaiNum": "๑๐",
      "title": "แรงดึงดูดทางความคิดกับชีวิต ไวรัส และสนามควอนตัม",
      "sub": "จากคำพูดตอนขับรถ ถึงเกราะป้องกันไวรัส แล้วดูว่าข้ออ้างว่ารังสีความคิดคือสนามแม่เหล็กไฟฟ้าขัดกับตัวเองตรงไหน",
      "status": "ready"
    },
    {
      "slug": "ch11",
      "order": 11,
      "thaiNum": "๑๑",
      "title": "จิตรู้สำนึกกับจิตใต้สำนึก",
      "sub": "จิตรู้สำนึกกับจิตใต้สำนึกไม่ใช่จิตสองดวง แต่เป็นจิตเดียวที่ทำงานคนละโหมด และอาจเก็บความทรงจำได้ลึกกว่าที่คุณคิด",
      "status": "ready"
    },
    {
      "slug": "ch12",
      "order": 12,
      "thaiNum": "๑๒",
      "title": "กลไกการทำงานของสมอง อะมิกดาลา และฮิปโปแคมปัส",
      "sub": "สมองสามชั้นที่แบ่งงานกันทำ อะมิกดาลาที่ผูกความทรงจำไว้กับอารมณ์และความกลัว และฮิปโปแคมปัสที่ตัดสินว่าอะไรควรเก็บไว้ถาวร",
      "status": "ready"
    },
    {
      "slug": "ch13",
      "order": 13,
      "thaiNum": "๑๓",
      "title": "เพิ่มเซลล์ประสาท ปรับบุคลิกภาพ พัฒนา IQ และ EQ",
      "sub": "เซลล์ประสาทสมองที่เกิดใหม่ได้ทุกวัน บุคลิกภาพที่ฝึกได้ และสองความฉลาดที่ต้องมาคู่กัน",
      "status": "ready"
    },
    {
      "slug": "ch14",
      "order": 14,
      "thaiNum": "๑๔",
      "title": "พลังแห่งความคิดสร้างสรรค์และการอ่านภาษากาย",
      "sub": "จากไอเดียที่แวบขึ้นเอง ถึงท่าทางที่บอกความจริงโดยไม่ต้องพูด",
      "status": "ready"
    },
    {
      "slug": "ch15",
      "order": 15,
      "thaiNum": "๑๕",
      "title": "เคล็ดลับสร้างความสัมพันธ์และโน้มน้าวใจ",
      "sub": "นิสัยต่าง วิธีโน้มน้าวก็ต่าง — ปรับน้ำเสียงและวิธีพูดให้ตรงกับคนตรงหน้า",
      "status": "ready"
    },
    {
      "slug": "ch16",
      "order": 16,
      "thaiNum": "๑๖",
      "title": "หลักธรรมสู่ความสำเร็จ และสมาธิเปลี่ยนสมอง",
      "sub": "อิทธิบาท 4 ขันติ สัจจะ และสัปปุริสธรรม หลักธรรมที่ใช้ได้จริงในชีวิตประจำวัน ก่อนพาไปดูว่างานวิจัยพบอะไรเรื่องสมาธิกับเนื้อสมอง",
      "status": "ready"
    },
    {
      "slug": "ch17",
      "order": 17,
      "thaiNum": "๑๗",
      "title": "บุญ ความรู้ในพุทธศาสนา และความสำเร็จอย่างพอเพียง",
      "sub": "บุญที่หนังสือเสนอว่าทำงานผ่านกลไกเดียวกับรังสีความคิด ความรู้ที่หนังสือเรียกว่าอภิญญา และบทปิดเล่มว่าทำไมความสำเร็จต้องพอเพียง",
      "status": "ready"
    }
  ]
}
