{
  "slug": "quantum-merit-power",
  "order": 7,
  "title": "พลังบุญควอนตัม",
  "author": "สิรวิชญ์ รัตน์จินดา",
  "blurb": "เล่มนี้นำแนวคิดฟิสิกส์ควอนตัม เช่น การประมวลผลของสมองแบบไม่อิงระยะทาง และหลักอนุรักษ์ข้อมูล มาเทียบเคียงกับเรื่องบุญ บาป และกฎแห่งกรรมในพุทธศาสนา ก่อนปิดท้ายด้วยการมองเส้นทางชีวิตผ่านแนวคิดอินทิกรัลเส้นทางของไฟน์แมน ว่าบุญบาปที่สั่งสมไว้มีน้ำหนักต่อความน่าจะเป็นของเส้นทางชีวิตอย่างไร",
  "coreIdeas": [
    {
      "label": "สมองควอนตัม",
      "text": "สมองมนุษย์มีกระบวนการประมวลผลเชิงควอนตัมที่ไม่ขึ้นกับระยะทางหรือเวลา ซึ่งอาจเป็นฐานของจิตและการรับรู้"
    },
    {
      "label": "ข้อมูลไม่สูญ",
      "text": "หลักอนุรักษ์ข้อมูลในฟิสิกส์ควอนตัมถูกเทียบเคียงว่า ข้อมูลบุญและบาปของแต่ละคนก็ไม่มีวันสูญหายไปจากจักรวาล"
    },
    {
      "label": "เส้นทางกรรม",
      "text": "ชีวิตแต่ละคนมีเส้นทางที่เป็นไปได้มากมาย โดยบุญและบาปที่สั่งสมไว้เป็นน้ำหนักโน้มเอียงให้เดินไปในเส้นทางหนึ่งมากกว่าอีกทาง"
    }
  ],
  "status": "ready",
  "sourcePdf": {
    "file": "1.7 E-book พลังบุญควอนตัม สิรวิชญ์ รัตน์จินดา.pdf",
    "bytes": 3720634
  },
  "chapters": [
    {
      "slug": "ch01",
      "order": 1,
      "thaiNum": "๑",
      "title": "สมการคลื่นของชเรอดิงเงอร์กับการประมวลผลควอนตัมของสมอง",
      "sub": "สมองที่ประมวลผลข้ามระยะทาง ตามหลักคณิตศาสตร์ควอนตัม",
      "status": "ready"
    },
    {
      "slug": "ch02",
      "order": 2,
      "thaiNum": "๒",
      "title": "การอนุรักษ์ข้อมูลควอนตัม",
      "sub": "เมื่อข้อมูลควอนตัมก๊อปไม่ได้ ลบไม่ได้ และซ่อนไม่มิด",
      "status": "ready"
    },
    {
      "slug": "ch03",
      "order": 3,
      "thaiNum": "๓",
      "title": "ปริศนาข้อมูลหลุมดำ",
      "sub": "เมื่อหลุมดำที่ดูเหมือนกลืนทุกอย่างจนไม่เหลือ กลับกลายเป็นเหตุผลที่หนักแน่นที่สุดว่าข้อมูลไม่มีวันสูญหายไปจากจักรวาล",
      "status": "ready"
    },
    {
      "slug": "ch04",
      "order": 4,
      "thaiNum": "๔",
      "title": "ข้อมูลบุญ-บาปเชิงควอนตัมภายใต้สนามกฎแห่งกรรม",
      "sub": "สนามที่มองไม่เห็น แต่เก็บทุกความคิด คำพูด และการกระทำของคุณไว้ครบ",
      "status": "ready"
    },
    {
      "slug": "ch05",
      "order": 5,
      "thaiNum": "๕",
      "title": "พุทธพจน์เรื่องบุญ-บาป (1)",
      "sub": "คำตอบของพระพุทธองค์เอง ต่อคำถามที่ว่า \"ทำดีได้ดี ทำชั่วได้ชั่ว\" เป็นจริงแค่ไหน",
      "status": "ready"
    },
    {
      "slug": "ch06",
      "order": 6,
      "thaiNum": "๖",
      "title": "พุทธพจน์เรื่องบุญ-บาป (2)",
      "sub": "เจตนาและเนื้อนาบุญ สองตัวแปรที่กำหนดน้ำหนักของบุญที่คุณสร้างขึ้นในแต่ละครั้ง",
      "status": "ready"
    },
    {
      "slug": "ch07",
      "order": 7,
      "thaiNum": "๗",
      "title": "พุทธพจน์เรื่องนรก",
      "sub": "พุทธพจน์ว่าด้วยคนพาลและทุกข์ในนรกที่เทียบกับทุกข์ใดไม่ได้ และข้ออนุมานของผู้เขียนว่านรกอาจเป็นภาวะจิตมากกว่าสถานที่ทางกายภาพ",
      "status": "ready"
    },
    {
      "slug": "ch08",
      "order": 8,
      "thaiNum": "๘",
      "title": "พุทธพจน์เรื่องสวรรค์",
      "sub": "เมื่อความสุขสามชั้นของคนดีเริ่มต้นตั้งแต่วันนี้ ไม่ต้องรอถึงชาติหน้า",
      "status": "ready"
    },
    {
      "slug": "ch09",
      "order": 9,
      "thaiNum": "๙",
      "title": "ธรรมที่ทำให้ไปเกิดในสวรรค์หรือนรก",
      "sub": "เมื่อกรรมบถ 10 อย่างคูณด้วยสี่ระดับความพัวพัน กลายเป็นธรรม 40 ประการชุดเดียวที่ตัดสินทั้งใจวันนี้ ภพหน้า และป้ายว่าใครคือพาลหรือบัณฑิต",
      "status": "ready"
    },
    {
      "slug": "ch10",
      "order": 10,
      "thaiNum": "๑๐",
      "title": "อินทิกรัลเส้นทางเชิงควอนตัมกับเส้นทางของชีวิตภายใต้บุญ บาป และกฎแห่งกรรม",
      "sub": "สูตรฟิสิกส์ที่ทรงพลังที่สุด กับคำตอบว่าทำไมบุญบาปเล็กๆ ที่สั่งสมทุกวัน เอียงเส้นทางทั้งชีวิตได้จริง",
      "status": "ready"
    }
  ]
}
