{
  "slug": "quantum-cell-to-nibbana-1",
  "order": 8,
  "title": "จากเซลล์ควอนตัม สู่นิพพาน 1",
  "author": "สิรวิชญ์ รัตน์จินดา",
  "blurb": "เล่มนี้เขียนในรูปบทสนทนา ชวนมองจุดกำเนิดของสิ่งมีชีวิตผ่านเรื่องเอนโทรปีและอุณหพลศาสตร์ แล้วต่อด้วยแนวคิดที่อธิบายตัณหาและอุปาทานเสมือนปมทอพอโลจีของคลื่นจิตที่ผูกโยงการเวียนว่ายตายเกิด ก่อนจะชี้ทางคลายปมเหล่านั้นด้วยวิปัสสนาไปสู่สภาวะนิพพาน",
  "coreIdeas": [
    {
      "label": "เอนโทรปี",
      "text": "สิ่งมีชีวิตถือกำเนิดและดำรงอยู่ได้ด้วยการต้านความไร้ระเบียบของจักรวาลไว้ชั่วคราว ตามกฎอุณหพลศาสตร์"
    },
    {
      "label": "ปมตัณหา",
      "text": "ตัณหาและอุปาทานถูกอธิบายเหมือนปมทอพอโลจีของคลื่นความถี่จิตที่ผูกวิญญาณให้เวียนว่ายตายเกิดต่อไป"
    },
    {
      "label": "คลายปม",
      "text": "การเจริญวิปัสสนาคือกระบวนการค่อยๆ คลายปมแห่งตัณหาเหล่านั้น จนกระทั่งเข้าถึงสภาวะนิพพาน"
    }
  ],
  "status": "ready",
  "sourcePdf": {
    "file": "1.8 E-Book จากเซลล์ควอนตัม สู่นิพพาน 1 สิรวิชญ์ รัตน์จินดา.pdf",
    "bytes": 6194390
  },
  "chapters": [
    {
      "slug": "ch01",
      "order": 1,
      "thaiNum": "๑",
      "title": "เอนโทรปีกับชีวิต",
      "sub": "วิธีอ่านหนังสือที่เอไอเขียนครึ่งเล่ม · เอนโทรปีที่ไม่ใช่ความรก · และหกเหลี่ยมในกระทะ",
      "status": "ready"
    },
    {
      "slug": "ch02",
      "order": 2,
      "thaiNum": "๒",
      "title": "กำเนิดวิญญาณควอนตัมและความพัวพันของนามรูป",
      "sub": "พระสูตรที่เล่าขึ้นเพื่อตอบเรื่องวรรณะ · ไกลซีนบนดาวหาง · และสิ่งที่ทำให้คลื่นยุบตัวจริงๆ",
      "status": "ready"
    },
    {
      "slug": "ch03",
      "order": 3,
      "thaiNum": "๓",
      "title": "สตริงแห่งชีวิต",
      "sub": "ทฤษฎีที่ยังไม่มีคำทำนายใดถูกยืนยัน · วีลเลอร์ที่ไม่ได้หมายความอย่างนั้น · และข้อสรุปที่ถูกใส่ไว้ในอุปมา",
      "status": "ready"
    },
    {
      "slug": "ch04",
      "order": 4,
      "thaiNum": "๔",
      "title": "ฟิสิกส์ปะทะปรัชญากรีก",
      "sub": "สองคนที่เห็นต่างกันถูกรวมเป็นคนเดียว · หนอนสองหัวที่ตอบอริสโตเติลได้ · และนามรูปที่ไม่ใช่จิตลงมาสวมร่าง",
      "status": "ready"
    },
    {
      "slug": "ch05",
      "order": 5,
      "thaiNum": "๕",
      "title": "โมเลกุลชีวิตในอวกาศ",
      "sub": "ของจริงที่หนักกว่าที่คิด · คำเดียวที่ใช้กับข้อเสนอสามระดับ · และรสเอ๋ยที่อธิบายได้ด้วยลิ้น",
      "status": "ready"
    },
    {
      "slug": "ch06",
      "order": 6,
      "thaiNum": "๖",
      "title": "วิวัฒนาการแห่งสมองกับตัณหาและอุปาทาน",
      "sub": "วงจรความอยากที่เล่าไว้ถูก · ชื่อที่ตั้งผิดเมื่อร้อยปีก่อน · และร่างกายที่ไม่ได้เป็นกับดัก",
      "status": "ready"
    },
    {
      "slug": "ch07",
      "order": 7,
      "thaiNum": "๗",
      "title": "แรงกดดันทางอุณหพลศาสตร์สร้างชีวิต",
      "sub": "ฟิสิกส์ที่ถูกที่สุดในเล่ม · กฎที่ยังไม่ใช่กฎ · และความตายทางความร้อนที่ไม่ใช่นิพพาน",
      "status": "ready"
    },
    {
      "slug": "ch08",
      "order": 8,
      "thaiNum": "๘",
      "title": "สรีรวิทยาแห่งตัณหาและความทุกข์",
      "sub": "ลูกศรสองดอกที่เทียบไว้ตรง · สมองสามชั้นที่ไม่มีอยู่จริง · และคำว่าฝังฮาร์ดไวร์ที่ไม่ควรใช้",
      "status": "ready"
    },
    {
      "slug": "ch09",
      "order": 9,
      "thaiNum": "๙",
      "title": "กิเลส ทุนนิยม และเอนโทรปี",
      "sub": "แนวคิดที่มีเจ้าของมาก่อน · สัตว์ที่กักตุนเหมือนกัน · และการกดไว้ที่ไม่ใช่การละ",
      "status": "ready"
    },
    {
      "slug": "ch10",
      "order": 10,
      "thaiNum": "๑๐",
      "title": "วิญญาณวิวัฒนาการ",
      "sub": "คำถามที่ดีกว่าคำตอบ · สิ่งที่ถูกปฏิเสธไว้กลับมาในชื่อใหม่ · และกรรมที่คือเจตนา",
      "status": "ready"
    },
    {
      "slug": "ch11",
      "order": 11,
      "thaiNum": "๑๑",
      "title": "ปมทอพอโลจีแห่งตัณหาและอุปาทาน",
      "sub": "สิบเอ็ดมิติที่ไม่ใช่มิติของอวกาศ · เกราะที่ทำงานเฉพาะตอนหนาวจัด · และปมที่ถูกใช้บอกให้คนยอมรับ",
      "status": "ready"
    },
    {
      "slug": "ch12",
      "order": 12,
      "thaiNum": "๑๒",
      "title": "พุทธพจน์เรื่องทฤษฎีความน่าจะเป็น",
      "sub": "อุปมาที่บอกตรงข้ามกับที่ถูกอ่าน · สิ่งที่อินทิกรัลเส้นทางคำนวณ · และข้อที่ต้องปฏิเสธเพราะทำร้ายคน",
      "status": "ready"
    },
    {
      "slug": "ch13",
      "order": 13,
      "thaiNum": "๑๓",
      "title": "นามขันธ์กับโครงสร้างสมอง ๑๑ มิติ",
      "sub": "ขันธ์ที่ถูกจัดเป็นบันได · ตัวเลขมิติที่ถูกแจกหน้าที่ · และคำชมที่ควรระวังที่สุด",
      "status": "ready"
    },
    {
      "slug": "ch14",
      "order": 14,
      "thaiNum": "๑๔",
      "title": "คลื่นความถี่ควอนตัมในสภาวะนิพพาน",
      "sub": "กำลังเรียบเรียง",
      "status": "building"
    }
  ]
}
