{
  "slug": "trilaksana-quantum",
  "order": 1,
  "title": "ไตรลักษณ์ในควอนตัม",
  "author": "สิรวิชญ์ รัตน์จินดา",
  "blurb": "เล่มแรกของชุดพาไปมองสิ่งรอบตัวตั้งแต่สมาร์ตโฟนในมือไปจนถึงดวงดาวไกลโพ้น ผ่านแว่นสามชั้นคือความไม่เที่ยง ความทนอยู่สภาพเดิมไม่ได้ และความไม่มีตัวตนแท้จริง โดยใช้ความรู้วิทยาศาสตร์สมัยใหม่เป็นเครื่องมือช่วยให้เห็นสิ่งที่หนังสือเรียกว่าไตรลักษณ์ได้ชัดขึ้น ไม่ใช่การพิสูจน์ว่าพุทธศาสนาถูกหรือผิด",
  "coreIdeas": [
    {
      "label": "ไม่เที่ยง",
      "pali": "อนิจจัง",
      "text": "ทุกสิ่งเปลี่ยนแปลงอยู่ตลอดเวลา ไม่มีสิ่งใดคงสภาพเดิมได้แม้ชั่วขณะ"
    },
    {
      "label": "ทนอยู่เดิมไม่ได้",
      "pali": "ทุกขัง",
      "text": "เพราะเปลี่ยนแปลงตลอดเวลา จึงไม่มีสิ่งใดถูกบังคับให้อยู่ในสภาพเดิมได้ตามที่ใจต้องการ"
    },
    {
      "label": "ไม่มีตัวตนแท้จริง",
      "pali": "อนัตตา",
      "text": "แยกส่วนลงไปเรื่อยๆ จะไม่พบแก่นที่เป็น 'ตัวมันเอง' อย่างถาวร มีแต่ส่วนประกอบที่มาประชุมกันชั่วคราว"
    }
  ],
  "status": "ready",
  "sourcePdf": {
    "file": "1.1 E-book ไตรลักษณ์ในควอนตัม สิรวิชญ์ รัตน์จินดา.pdf",
    "bytes": 6823079
  },
  "chapters": [
    {
      "slug": "ch01",
      "order": 1,
      "thaiNum": "๑",
      "title": "ความลับแห่งไตรลักษณ์",
      "sub": "กฎสามข้อที่ซ่อนอยู่ในทุกสิ่ง",
      "status": "ready"
    },
    {
      "slug": "ch02",
      "order": 2,
      "thaiNum": "๒",
      "title": "ไตรลักษณ์ในขันธ์ ๕ (กาย)",
      "sub": "ซูมเข้าไปในร่างกายจนหาตัวตนไม่เจอ",
      "status": "ready"
    },
    {
      "slug": "ch03",
      "order": 3,
      "thaiNum": "๓",
      "title": "ไตรลักษณ์ในขันธ์ ๕ (จิต)",
      "sub": "ตามสายพานในใจ จากรับรู้จนถึงคำพูดและการกระทำ",
      "status": "ready"
    },
    {
      "slug": "ch04",
      "order": 4,
      "thaiNum": "๔",
      "title": "ไตรลักษณ์ในจักรวาลวิทยาสมัยใหม่ (๑)",
      "sub": "ตามรอยจักรวาลจากจุดที่ไม่มีอะไรเป็นตัวของมันเอง จนถึงเถ้าดาวที่กลายเป็นตัวเรา",
      "status": "ready"
    },
    {
      "slug": "ch05",
      "order": 5,
      "thaiNum": "๕",
      "title": "ไตรลักษณ์ในจักรวาลวิทยาสมัยใหม่ (๒)",
      "sub": "จักรวาลจะจบแบบไหน และแท้จริงมันประกอบจากอะไรกันแน่",
      "status": "ready"
    },
    {
      "slug": "ch06",
      "order": 6,
      "thaiNum": "๖",
      "title": "ไตรลักษณ์ในฟิสิกส์ควอนตัม (๑)",
      "sub": "ก้อนแข็งที่แท้จริงคือพลังงานที่สั่นไหว",
      "status": "ready"
    },
    {
      "slug": "ch07",
      "order": 7,
      "thaiNum": "๗",
      "title": "ไตรลักษณ์ในฟิสิกส์ควอนตัม (๒)",
      "sub": "โลกที่คุณเห็นไม่ใช่โลกเดียวกับที่ผึ้งหรืองูเห็น",
      "status": "ready"
    },
    {
      "slug": "ch08",
      "order": 8,
      "thaiNum": "๘",
      "title": "ไตรลักษณ์ในทฤษฎีวิวัฒนาการ (๑)",
      "sub": "จากบิ๊กแบงถึงตัวคุณ ไม่มีจุดไหนหยุดนิ่งเลย",
      "status": "ready"
    },
    {
      "slug": "ch09",
      "order": 9,
      "thaiNum": "๙",
      "title": "ไตรลักษณ์ในทฤษฎีวิวัฒนาการ (๒)",
      "sub": "สายพันธุ์เปลี่ยน ร่างกายเปลี่ยน เซลล์เกิดดับทุกวินาที",
      "status": "ready"
    }
  ]
}
