{
  "slug": "quantum-touch",
  "order": 6,
  "title": "สัมผัสควอนตัม",
  "author": "สิรวิชญ์ รัตน์จินดา",
  "blurb": "เล่มนี้ใช้แนวคิดลำดับแห่งโยงใย (Implicate Order) ของเดวิด โบห์ม มาช่วยมองว่าการเห็น การได้ยิน และการรับสัมผัสทุกชนิดที่เรานึกว่าเป็นของจริง แท้จริงเป็นเพียงสิ่งที่ขันธ์ ๕ ปรุงแต่งขึ้นมา เมื่อคลายความยึดติดในสัมผัสเหล่านี้ได้ หนังสือจึงค่อยพาไปสู่เรื่องวิญญาณและนิพพานตามพุทธพจน์ในช่วงท้ายเล่ม",
  "coreIdeas": [
    {
      "label": "ลำดับโยงใย",
      "text": "จักรวาลไม่ได้แยกเป็นชิ้นส่วน แต่ห่อหุ้มกันอยู่ในลำดับที่ลึกกว่าสิ่งที่ตาเห็น แล้วค่อยเผยตัวออกมาเป็นภาพ เสียง และสัมผัส"
    },
    {
      "label": "ขันธ์ ๕",
      "text": "การเห็น ได้ยิน และรับสัมผัสทั้งหมด ล้วนเป็นกระบวนการปรุงแต่งของขันธ์ ๕ ไม่ใช่ตัวตนที่แท้จริงของสิ่งภายนอก"
    },
    {
      "label": "หลุดพ้น",
      "pali": "นิพพาน",
      "text": "เมื่อเห็นว่าการรับสัมผัสเป็นเพียงมายา ตัณหาและอุปาทานที่ยึดติดกับสิ่งที่รับรู้จะค่อยคลายลง นำไปสู่ความหลุดพ้น"
    }
  ],
  "status": "ready",
  "sourcePdf": {
    "file": "1.6 E-book สัมผัสควอนตัม สิรวิชญ์ รัตน์จินดา.pdf",
    "bytes": 5445380
  },
  "chapters": [
    {
      "slug": "ch01",
      "order": 1,
      "thaiNum": "๑",
      "title": "นักมายากลแห่งธรรมชาติ",
      "sub": "เสียงของอาจารย์ที่ทำให้มีหนังสือชุดนี้ · โบห์มที่หนังสือไม่ได้เล่า · และไอน์สไตน์ที่ไม่ได้พูดอย่างนั้น",
      "status": "ready"
    },
    {
      "slug": "ch02",
      "order": 2,
      "thaiNum": "๒",
      "title": "ห่อหุ้ม-เผยออก ของเดวิด โบห์ม",
      "sub": "อุปกรณ์ที่มีอยู่จริง · เหตุผลที่หยดหมึกกลับมาได้ · และข้อจำกัดที่ทำให้อุปมาตรงกับธรรมะยิ่งขึ้น",
      "status": "ready"
    },
    {
      "slug": "ch03",
      "order": 3,
      "thaiNum": "๓",
      "title": "ลำดับแห่งโยงใยกับทฤษฎีควอนตัม",
      "sub": "อนุภาคที่เป็นการสั่นของสนาม · โบห์มที่พาไปถึงเบลล์ · และความเชื่อมโยงที่ส่งข้อมูลไม่ได้",
      "status": "ready"
    },
    {
      "slug": "ch04",
      "order": 4,
      "thaiNum": "๔",
      "title": "ลำดับแห่งโยงใยกับชีวิต",
      "sub": "ต้นไม้ที่สร้างขึ้นจากอากาศ · มือที่ไม่เคยแตะโต๊ะ · และร่างกายที่แต่ละส่วนมีอายุไม่เท่ากัน",
      "status": "ready"
    },
    {
      "slug": "ch05",
      "order": 5,
      "thaiNum": "๕",
      "title": "ลำดับแห่งโยงใยกับวิถีจิต",
      "sub": "การรับรู้ที่มาเป็นช่วงๆ · จดหมายของเจ้าหญิงเอลิซาเบธ · และฮูมที่ไปถึงอนัตตาด้วยการนั่งคิด",
      "status": "ready"
    },
    {
      "slug": "ch06",
      "order": 6,
      "thaiNum": "๖",
      "title": "ลำดับแห่งโยงใยกับเสียง",
      "sub": "เสียงที่ยังก้องอยู่สองถึงสี่วินาที · ทำนองที่แตกเป็นสองสายเมื่อเร่งจังหวะ · และเสียงที่สูงขึ้นไม่มีที่สิ้นสุด",
      "status": "ready"
    },
    {
      "slug": "ch07",
      "order": 7,
      "thaiNum": "๗",
      "title": "ลำดับแห่งโยงใยกับภาพ",
      "sub": "ไฟสองดวงที่ไม่มีอะไรวิ่งอยู่ระหว่างกลาง · รูในสายตาที่คุณไม่เคยเห็น · และตาที่กระโดดสี่ครั้งต่อวินาที",
      "status": "ready"
    },
    {
      "slug": "ch08",
      "order": 8,
      "thaiNum": "๘",
      "title": "โฮโลแกรม (Hologram)",
      "sub": "ลายริ้วที่เก็บทิศทางของแสง · สามสิบปีที่ตามหาความจำแล้วไม่เจอ · และเด็กที่มีสมองซีกเดียว",
      "status": "ready"
    },
    {
      "slug": "ch09",
      "order": 9,
      "thaiNum": "๙",
      "title": "ลำดับแห่งโยงใยกับวิญญาณขันธ์",
      "sub": "ว่างเปล่าที่ไม่ได้แปลว่าไม่มี · สามทฤษฎีที่สถานะไม่เท่ากัน · และการแวบขึ้นในใจที่วัดได้",
      "status": "ready"
    },
    {
      "slug": "ch10",
      "order": 10,
      "thaiNum": "๑๐",
      "title": "โฮโลแกรมกับสัญญาขันธ์",
      "sub": "แอ่งน้ำที่แท้จริงคือภาพของท้องฟ้า · ความจำที่ประกอบขึ้นใหม่ทุกครั้ง · และการตรวจสอบง่ายๆ ด้วยอุปมาอีกสี่ข้อ",
      "status": "ready"
    },
    {
      "slug": "ch11",
      "order": 11,
      "thaiNum": "๑๑",
      "title": "ลำดับแห่งโยงใยกับเวทนาขันธ์",
      "sub": "ฟองที่แตกเพราะมันเป็นฟอง · ความชอบที่มาก่อนความคิดหนึ่งในสิบวินาที · และข้อต่อที่ฝึกได้ในชีวิตประจำวัน",
      "status": "ready"
    },
    {
      "slug": "ch12",
      "order": 12,
      "thaiNum": "๑๒",
      "title": "ลำดับแห่งโยงใยกับสังขารขันธ์และรูปขันธ์",
      "sub": "ต้นกล้วยที่ลำต้นเป็นแค่กาบใบ · เนินที่ดูชันขึ้นเมื่อเราเหนื่อย · และใบไม้ที่ไม่ได้เขียว",
      "status": "ready"
    },
    {
      "slug": "ch13",
      "order": 13,
      "thaiNum": "๑๓",
      "title": "ชุดที่ประสานกัน (Ensemble)",
      "sub": "นาฬิกาที่ระเบิดนิวเคลียร์ทิ้งไว้บนอากาศ · เซลล์ที่แยกแล้วกลับมาเรียงตัวเอง · และสองชั้นที่ถูกเติมเข้ามา",
      "status": "ready"
    },
    {
      "slug": "ch14",
      "order": 14,
      "thaiNum": "๑๔",
      "title": "เหตุแห่งความหลุดพ้นและวิญญาณที่ไปเกิดใหม่",
      "sub": "คำว่าเบื่อหน่ายที่อ่านผิดได้ง่าย · ไฟที่ถูกเรียกชื่อตามเชื้อ · และคลื่นที่ไม่มีอะไรเดินทาง",
      "status": "ready"
    },
    {
      "slug": "ch15",
      "order": 15,
      "thaiNum": "๑๕",
      "title": "ช่างสร้างเรือนของพระพุทธองค์กับรูปแบบ (Formal) ของอริสโตเติล",
      "sub": "คำตอบที่อยู่ในบรรทัดสุดท้ายของคาถาเอง · ยุคที่โลกคิดพร้อมกัน · และรังผึ้งที่ไม่มีผึ้งตัวไหนคำนวณ",
      "status": "ready"
    },
    {
      "slug": "ch16",
      "order": 16,
      "thaiNum": "๑๖",
      "title": "อาหารของวิญญาณ (1)",
      "sub": "สิ่งที่ถูกเลี้ยงไม่ใช่สิ่งที่ตั้งอยู่เอง · ใจที่ไม่ยอมเงียบเมื่อไม่มีอะไรเข้ามา · และลูกศรดอกที่สอง",
      "status": "ready"
    },
    {
      "slug": "ch17",
      "order": 17,
      "thaiNum": "๑๗",
      "title": "อาหารของวิญญาณ (2)",
      "sub": "ลำแสงที่มองไม่เห็นจนกว่าจะมีฝุ่น · ท้องฟ้าสีดำกลางวันแสกๆ · และรายการอุปมาที่ตอบคำถามของตัวเอง",
      "status": "ready"
    },
    {
      "slug": "ch18",
      "order": 18,
      "thaiNum": "๑๘",
      "title": "นิพพาน (พุทธพจน์ที่เกี่ยวข้อง)",
      "sub": "ปฐมฌานก็พอแล้ว · เข้าฌานเขียนคืออะไรกันแน่ · และแผนที่สี่ชั้นของทั้งเล่ม",
      "status": "ready"
    }
  ]
}
