{
  "slug": "quantum-cell-to-nibbana-2",
  "order": 9,
  "title": "จากเซลล์ควอนตัม สู่นิพพาน 2",
  "author": "สิรวิชญ์ รัตน์จินดา",
  "blurb": "เล่มนี้เขียนในรูปบทสนทนา ต่อเนื่องจากเล่มแรก เริ่มจากการชี้ให้เห็นว่าร่างกายและสิ่งที่รับรู้ทั้งหมดเป็นเพียงมายาภาพที่สมองสร้างขึ้นจากคลื่นความน่าจะเป็น แล้วโยงเข้ากับแนวคิดคลื่นนำร่องที่มองว่าจิตรู้สำนึกขับเคลื่อนวิวัฒนาการอย่างมีทิศทาง ก่อนปิดท้ายด้วยการนำหลักสติปัฏฐาน ๔ มาใช้ปฏิบัติจริงเพื่อเข้าถึงความหลุดพ้น",
  "coreIdeas": [
    {
      "label": "มายาภาพ",
      "text": "ร่างกายและการรับรู้ทางประสาทสัมผัสทั้งหมด แท้จริงเป็นเพียงฟังก์ชันคลื่นที่สมองเรนเดอร์ขึ้นมาให้รู้สึกเหมือนของแข็งจริง"
    },
    {
      "label": "คลื่นนำร่อง",
      "text": "ทฤษฎีคลื่นนำร่องของเดวิด โบห์ม ถูกนำมาอธิบายว่าจิตรู้สำนึกและกฎแห่งกรรมขับเคลื่อนวิวัฒนาการอย่างมีทิศทาง ไม่ใช่เพียงการสุ่ม"
    },
    {
      "label": "สติปัฏฐาน",
      "pali": "สติปัฏฐาน",
      "text": "การพิจารณากาย เวทนา จิต และธรรม คือหนทางปฏิบัติจริงที่จะคลี่คลายมายาภาพทั้งหมดจนถึงความหลุดพ้น"
    }
  ],
  "status": "ready",
  "sourcePdf": {
    "file": "1.9 E-Book จากเซลล์ควอนตัม สู่นิพพาน 2 สิรวิชญ์ รัตน์จินดา.pdf",
    "bytes": 6277493
  },
  "chapters": [
    {
      "slug": "ch01",
      "order": 1,
      "thaiNum": "๑",
      "title": "มายาภาพ ตัณหา และอุปาทาน",
      "sub": "ห้าอุปมาที่ยกมาถูก · อะตอมที่ไม่ได้ว่างเปล่า · และสัพพัญญุตญาณที่ท่านปฏิเสธเอง",
      "status": "ready"
    },
    {
      "slug": "ch02",
      "order": 2,
      "thaiNum": "๒",
      "title": "ทอพอโลจีกับดีเอ็นเอ",
      "sub": "เกลียวที่เล่าไว้ถูกทั้งหมด · คำว่ายุบตัวสองความหมาย · และปริศนาที่ถูกแก้ไปแล้ว",
      "status": "ready"
    },
    {
      "slug": "ch03",
      "order": 3,
      "thaiNum": "๓",
      "title": "จิตรู้สำนึกขับเคลื่อนวิวัฒนาการ",
      "sub": "ตรงที่ผู้ช่วยตอบถูกแล้วถอนคำตอบ · การทดลองที่ตอบไปแล้วแปดสิบปีก่อน · และกลไกจริงที่ผู้เขียนกำลังมองหา",
      "status": "ready"
    },
    {
      "slug": "ch04",
      "order": 4,
      "thaiNum": "๔",
      "title": "คลื่นนำร่องแห่งวิวัฒนาการ",
      "sub": "ทฤษฎีที่ทำนายเหมือนเดิมทุกอย่าง · เสียงสะท้อนที่วัดการกระจายของข้อมูล · และสุดโต่งสองข้างที่ถูกปฏิเสธ",
      "status": "ready"
    },
    {
      "slug": "ch05",
      "order": 5,
      "thaiNum": "๕",
      "title": "คลื่นนำร่องกับอินทิกรัลเส้นทาง",
      "sub": "การเชื่อมที่ถูกต้องจริง · ข้อจำกัดที่ทฤษฎีวางไว้เอง · และปลาถ้ำที่กลไกจริงน่าทึ่งกว่า",
      "status": "ready"
    },
    {
      "slug": "ch06",
      "order": 6,
      "thaiNum": "๖",
      "title": "ความน่าจะเป็น คลื่นนำร่อง และสนามกฎแห่งกรรม",
      "sub": "ลำดับที่พระสูตรวางไว้ · สมาธิที่วัดได้ด้วยเครื่องวัดคลื่นสมอง · และบุญที่ไม่ใช่เกราะ",
      "status": "ready"
    },
    {
      "slug": "ch07",
      "order": 7,
      "thaiNum": "๗",
      "title": "ระเบียบควอนตัมทางชีวภาพ",
      "sub": "งานวิจัยที่ผู้เขียนหามาเองและเป็นของจริง · การจับกันที่ไม่มีปริศนา · และมะเร็งที่อ่านสาเหตุได้จากจีโนม",
      "status": "ready"
    },
    {
      "slug": "ch08",
      "order": 8,
      "thaiNum": "๘",
      "title": "วิทยาศาสตร์องค์รวม",
      "sub": "คำถามที่ผู้ช่วยปฏิเสธได้ถูก · ปริภูมิแฝงที่ไม่ใช่ระเบียบแฝงเร้น · และสิ่งที่ข้อพิสูจน์ทำไม่ได้",
      "status": "ready"
    },
    {
      "slug": "ch09",
      "order": 9,
      "thaiNum": "๙",
      "title": "กายานุปัสสนาสติปัฏฐาน (พิจารณากายในกาย)",
      "sub": "คำสรุปท้ายที่คนข้ามกันเกือบทุกครั้ง · ลมหายใจที่วัดผลได้ · และคำเตือนที่อยู่ในพระไตรปิฎกเอง",
      "status": "ready"
    },
    {
      "slug": "ch10",
      "order": 10,
      "thaiNum": "๑๐",
      "title": "เวทนานุปัสสนาสติปัฏฐาน (พิจารณาเวทนาในเวทนา)",
      "sub": "คำสอนที่บอกให้เรียกชื่อความรู้สึก · เวทนาที่คนข้าม · และจังหวะจริงที่ช้ากว่าที่คิด",
      "status": "ready"
    },
    {
      "slug": "ch11",
      "order": 11,
      "thaiNum": "๑๑",
      "title": "จิตตานุปัสสนาสติปัฏฐาน (พิจารณาจิตในจิต)",
      "sub": "รายการตรวจที่ไม่ใช่ตารางคะแนน · การอ่านค่าโดยไม่เติมความรู้สึกผิด · และคู่ที่ต้องระวังที่สุด",
      "status": "ready"
    },
    {
      "slug": "ch12",
      "order": 12,
      "thaiNum": "๑๒",
      "title": "ธัมมานุปัสสนาสติปัฏฐาน (1) นิวรณ์ ขันธ์ อายตนะ โพชฌงค์",
      "sub": "สี่ข้อที่หมวดนิวรณ์สั่งให้รู้ · อาหารของนิวรณ์แต่ละข้อ · และโพชฌงค์ที่มีจังหวะของมัน",
      "status": "ready"
    },
    {
      "slug": "ch13",
      "order": 13,
      "thaiNum": "๑๓",
      "title": "ธัมมานุปัสสนาสติปัฏฐาน (2) อริยสัจ 4",
      "sub": "สามรอบสิบสองอาการ · หน้าที่ที่ต่างกันสี่อย่าง · และการละตรงจุดที่มันเกิด",
      "status": "ready"
    },
    {
      "slug": "ch14",
      "order": 14,
      "thaiNum": "๑๔",
      "title": "คลื่นนำร่องสู่ความหลุดพ้น ทางสายเดียวสู่นิพพาน",
      "sub": "รายงานการปฏิบัติที่ซื่อตรง · เจ็ดวันถึงเจ็ดปีที่ไม่ใช่การรับประกัน · และหนทางกลับบ้านที่บทเองเพิ่งปฏิเสธ",
      "status": "ready"
    },
    {
      "slug": "ch15",
      "order": 15,
      "thaiNum": "๑๕",
      "title": "หยุดที่เวทนา",
      "sub": "กำลังเรียบเรียง",
      "status": "building"
    },
    {
      "slug": "ch16",
      "order": 16,
      "thaiNum": "๑๖",
      "title": "สถาปัตยกรรมแห่งอัตตา ผลผลิตแห่งทุกข์",
      "sub": "กำลังเรียบเรียง",
      "status": "building"
    },
    {
      "slug": "ch17",
      "order": 17,
      "thaiNum": "๑๗",
      "title": "สถาปัตยกรรม AI กับการเข้าถึงสัจธรรม",
      "sub": "กำลังเรียบเรียง",
      "status": "building"
    }
  ]
}
