{
  "slug": "quantum-in-living-things",
  "order": 5,
  "title": "ควอนตัมในสิ่งมีชีวิต",
  "author": "สิรวิชญ์ รัตน์จินดา",
  "blurb": "เล่มนี้พาไปดูว่าปรากฏการณ์ควอนตัมทำงานอยู่จริงในสิ่งมีชีวิต ตั้งแต่อุโมงค์ควอนตัมในปฏิกิริยาของโมเลกุล ไปจนถึงสัญญาณไฟฟ้าชีวภาพที่บอกเซลล์ว่าจะประกอบร่างเป็นรูปใด แล้วชวนตั้งคำถามว่าอะไรคือสิ่งที่อยู่เบื้องหลังรูปร่างและพฤติกรรมของชีวิต ปิดท้ายด้วยข้อเสนอของผู้เขียนเองเรื่องวิวัฒนาการทางจิตและวิญญาณ ที่โยงกลับไปหาคำสอนเรื่องกฎแห่งกรรม",
  "coreIdeas": [
    {
      "label": "ชีวควอนตัม",
      "text": "สิ่งมีชีวิตไม่ได้ทำงานด้วยเคมีธรรมดาเท่านั้น แต่ใช้ปรากฏการณ์ระดับควอนตัมในโมเลกุลของตัวเองด้วย"
    },
    {
      "label": "ข้อมูลกำหนดรูป",
      "text": "รูปร่างของสิ่งมีชีวิตถูกกำหนดด้วยสนามข้อมูลและไฟฟ้าชีวภาพ ไม่ได้มาจากรหัสพันธุกรรมเพียงอย่างเดียว"
    },
    {
      "label": "จิตวิวัฒนาการ",
      "text": "จิตรู้สำนึกเกิดขึ้นตั้งแต่เซลล์แรกและวิวัฒนาการมาพร้อมกับร่างกาย เชื่อมกับสิ่งที่พุทธศาสนาเรียกว่าวิญญาณและกฎแห่งกรรม"
    }
  ],
  "status": "ready",
  "sourcePdf": {
    "file": "1.5 E-book ควอนตัมในสิ่งมีชีวิต สิรวิชญ์ รัตน์จินดา.pdf",
    "bytes": 10550399
  },
  "chapters": [
    {
      "slug": "ch01",
      "order": 1,
      "thaiNum": "๑",
      "title": "ชีวิตคืออะไร ?",
      "sub": "คำถามที่นักฟิสิกส์ถามไว้ตั้งแต่ปี 1944 · ผลึกไร้คาบที่กลายเป็นดีเอ็นเอ · และสเปกตรัมของชีวควอนตัม",
      "status": "ready"
    },
    {
      "slug": "ch02",
      "order": 2,
      "thaiNum": "๒",
      "title": "ชีวควอนตัม",
      "sub": "ประโยคที่จริงแต่ไม่บอกอะไร · คำบรรยายปี 1932 ที่เปลี่ยนประวัติศาสตร์ · และชั้นความสามารถของเลวิน",
      "status": "ready"
    },
    {
      "slug": "ch03",
      "order": 3,
      "thaiNum": "๓",
      "title": "ชีวควอนตัมกับวิวัฒนาการ",
      "sub": "ชิ้นส่วนของชีวิตที่พบในอวกาศ · ช่องว่างที่ยังไม่มีใครข้าม · และปรัชญาในฐานะผู้แผ้วถาง",
      "status": "ready"
    },
    {
      "slug": "ch04",
      "order": 4,
      "thaiNum": "๔",
      "title": "สัญญาณเคมีกับชีวิต",
      "sub": "ช่องทางที่ร่างกายคุยกับโลกโดยเราไม่รู้ตัว · ความจำที่ไม่ต้องมีสมอง · และคำถามที่ตอบไม่ได้เหมือนกันหมด",
      "status": "ready"
    },
    {
      "slug": "ch05",
      "order": 5,
      "thaiNum": "๕",
      "title": "อุโมงค์ควอนตัมในโมเลกุล",
      "sub": "คลื่นที่ไม่หยุดตรงหน้ากำแพง · การทดลองที่ใช้เวลาสิบห้าปี · และเหตุผลที่อนุภาคเบาสำคัญกับชีวิต",
      "status": "ready"
    },
    {
      "slug": "ch06",
      "order": 6,
      "thaiNum": "๖",
      "title": "การจับคู่โปรตีนแบบผสม (1)",
      "sub": "ภาพแม่กุญแจกับลูกกุญแจที่พังลง · ผู้ส่งสารที่ไม่ใช่ข้อความ · และเหตุผลที่ความยุ่งเหยิงทำให้แม่นยำขึ้น",
      "status": "ready"
    },
    {
      "slug": "ch07",
      "order": 7,
      "thaiNum": "๗",
      "title": "การจับคู่โปรตีนแบบผสม (2)",
      "sub": "สิ่งที่การทดลองทำจริง · รหัสเชิงผสมในจมูกของคุณ · และสามประโยคท้ายบทที่ควรชะลอ",
      "status": "ready"
    },
    {
      "slug": "ch08",
      "order": 8,
      "thaiNum": "๘",
      "title": "เอพิเจเนติกส์ เปิด-ปิดยีน",
      "sub": "ตำราเล่มเดียวกันที่เปิดคนละหน้า · ป้ายสามชนิดบนจีโนม · และคำตอบที่มีแล้วของคำถามว่าเซลล์รู้ได้อย่างไร",
      "status": "ready"
    },
    {
      "slug": "ch09",
      "order": 9,
      "thaiNum": "๙",
      "title": "เปิดยีนสุขภาพดี",
      "sub": "ฤดูหนาวแห่งความหิวโหย · รอยของบุหรี่ที่ลบได้ · และคำแนะนำสองชุดที่ไม่เท่ากัน",
      "status": "ready"
    },
    {
      "slug": "ch10",
      "order": 10,
      "thaiNum": "๑๐",
      "title": "ซีโนบอตและลูกอ๊อดปิกัสโซ ชีวิตที่ประกอบร่างขึ้นใหม่ได้",
      "sub": "ก้อนเซลล์ที่ว่ายน้ำได้ · หน้ากบที่กลับมาเป็นปกติ · และคำในวงเล็บที่เปลี่ยนข้อเสนอทั้งข้อ",
      "status": "ready"
    },
    {
      "slug": "ch11",
      "order": 11,
      "thaiNum": "๑๑",
      "title": "อภิปรัชญาของชีววิทยา (1)",
      "sub": "ปัญญารวมกับไฟฟ้าชีวภาพ · บนลงล่างที่ไม่ได้เหนือกายภาพ · และก้นชามที่ไม่ได้ดึงลูกแก้ว",
      "status": "ready"
    },
    {
      "slug": "ch12",
      "order": 12,
      "thaiNum": "๑๒",
      "title": "อภิปรัชญาของชีววิทยา (2)",
      "sub": "สองสนามที่ไม่ใช่สนามเดียวกัน · ข้ออ้างที่ไม่มีทางผิด · และไดโนเสาร์ที่อ่านไม่ได้",
      "status": "ready"
    },
    {
      "slug": "ch13",
      "order": 13,
      "thaiNum": "๑๓",
      "title": "พลานาเรีย สิ่งมีชีวิตอมตะ",
      "sub": "หนอนที่ตัดแล้วงอกใหม่ · ความจำที่รอดจากการตัดหัว · และหนอนสองหัวที่จีโนมไม่ได้ถูกแตะ",
      "status": "ready"
    },
    {
      "slug": "ch14",
      "order": 14,
      "thaiNum": "๑๔",
      "title": "ไฟฟ้าชีวภาพควบคุมเซลล์มะเร็ง",
      "sub": "เซลล์ที่หลุดออกจากวง · ชั้นควบคุมที่ต่อกันไม่ได้แข่งกัน · และประโยคที่ต้องปฏิเสธตรงๆ",
      "status": "ready"
    },
    {
      "slug": "ch15",
      "order": 15,
      "thaiNum": "๑๕",
      "title": "วิทยาศาสตร์กับจริยศาสตร์",
      "sub": "ประโยคเรื่องกรรมที่ต้องปฏิเสธ · ก้อนเกลือกับแม่น้ำ · และความดีที่วัดการแพร่ได้",
      "status": "ready"
    },
    {
      "slug": "ch16",
      "order": 16,
      "thaiNum": "๑๖",
      "title": "ทฤษฎีวิวัฒนาการทางจิต",
      "sub": "การทดลองที่ตอบคำถามนี้ไปแล้วตั้งแต่ปี 1943 · พิษงูที่เล่าถูกครึ่งหนึ่ง · และพฤติกรรมที่นำหน้ายีนได้",
      "status": "ready"
    },
    {
      "slug": "ch17",
      "order": 17,
      "thaiNum": "๑๗",
      "title": "หมึกยักษ์ เอเลี่ยนจากต่างดาว",
      "sub": "แขนแปดข้างที่คิดเองได้ · ตัวรับแสงที่หาเจอแล้วและอยู่ในผิวหนัง · และข้อมูลใหม่ที่ความบังเอิญสร้างได้",
      "status": "ready"
    },
    {
      "slug": "ch18",
      "order": 18,
      "thaiNum": "๑๘",
      "title": "วิญญาณวิวัฒนาการ",
      "sub": "รูปตัวซีที่ไม่มีใครคิดออก · เอ๊ะของผู้เขียนที่ดาร์วินก็เคยรู้สึก · และครึ่งหลังของคำว่าบังเอิญ",
      "status": "ready"
    },
    {
      "slug": "ch19",
      "order": 19,
      "thaiNum": "๑๙",
      "title": "บทสรุปของชีวิต",
      "sub": "คำว่าทุกข์ที่แปลให้ตรง · เพนโรสที่ไม่ได้พูดอย่างนั้น · มายากลที่เกิดขึ้นจริง · และแผนที่สี่ชั้นของทั้งเล่ม",
      "status": "ready"
    }
  ]
}
